{
  "$schema": "https://json-schema.org/draft/2020-12/schema",
  "$id": "https://tcger.app/schemas/card-geometry-readiness-policy/v1",
  "title": "TCGer CardGeometryReadinessPolicy v1",
  "description": "Minimum content a card-geometry corpus release must contain before a preflight may report it ready. A release binds to exactly one policy by id and file hash; the training wrapper additionally requires the policy hash it expects, so a release cannot lower its own bar.",
  "type": "object",
  "additionalProperties": false,
  "required": [
    "schema",
    "policyId",
    "requiredSplits",
    "minimumRecordsPerSplit",
    "minimumInstancesPerSplit",
    "minimumRealEvaluationSessions",
    "realOnlySplits",
    "requiredSceneSlices",
    "requiredLeakageKeys",
    "metricEligibleCornerSources"
  ],
  "properties": {
    "schema": {
      "const": "https://tcger.app/schemas/card-geometry-readiness-policy/v1"
    },
    "policyId": {
      "type": "string",
      "minLength": 1,
      "maxLength": 160,
      "pattern": "^[A-Za-z0-9][A-Za-z0-9._:-]*$"
    },
    "description": { "type": "string", "maxLength": 2000 },
    "requiredSplits": {
      "type": "array",
      "minItems": 1,
      "uniqueItems": true,
      "items": { "$ref": "#/$defs/split" }
    },
    "minimumRecordsPerSplit": { "$ref": "#/$defs/perSplitCount" },
    "minimumInstancesPerSplit": { "$ref": "#/$defs/perSplitCount" },
    "minimumMetricEligibleInstances": {
      "description": "Minimum instances per split whose four corners are coordinate-known and all have a cornerSource admitted by metricEligibleCornerSources. Optional for legacy fixture and smoke policies; required by the approved training policy.",
      "$ref": "#/$defs/perSplitCount"
    },
    "allowedSourceTiers": {
      "description": "Data-use tiers permitted in the release. Optional only for immutable legacy releases; a training policy must bind this field and SOURCE_TIER enforces it.",
      "type": "array",
      "minItems": 1,
      "uniqueItems": true,
      "items": { "$ref": "#/$defs/sourceTier" }
    },
    "minimumRealEvaluationSessions": {
      "description": "Distinct real-capture session ids that must appear in the `test` split.",
      "type": "integer",
      "minimum": 0
    },
    "realOnlySplits": {
      "description": "Splits in which synthetic records are forbidden.",
      "type": "array",
      "uniqueItems": true,
      "items": { "$ref": "#/$defs/split" }
    },
    "requiredSceneSlices": {
      "type": "array",
      "items": {
        "type": "object",
        "additionalProperties": false,
        "required": ["sceneSlice", "split", "minimumInstances"],
        "properties": {
          "sceneSlice": {
            "type": "string",
            "minLength": 1,
            "maxLength": 160,
            "pattern": "^[A-Za-z0-9][A-Za-z0-9._:-]*$"
          },
          "split": { "$ref": "#/$defs/split" },
          "minimumInstances": { "type": "integer", "minimum": 1 },
          "minimumMetricEligibleInstances": {
            "description": "Minimum instances in this exact split and scene slice whose four corners are coordinate-known and metric-eligible. Required semantically for every slice in a training-purpose release; optional here for immutable legacy policies.",
            "type": "integer",
            "minimum": 0
          }
        }
      }
    },
    "requireTargetSemantics": {
      "description": "When true, preflight TARGET_SEMANTICS fails unless the manifest declares a targetSemantics contract and every real archive record carries verified primary-category provenance. Legacy releases built before the category-aware importer omit the declaration and can only bind policies that leave this false.",
      "type": "boolean"
    },
    "metricEligibleCornerSources": {
      "description": "Corner provenance values whose known coordinates may enter corner-error metrics. The schema limits this to `human` and `synthetic`; `maskFit` and `detector` corners are reported but can never become ground truth through policy configuration.",
      "type": "array",
      "minItems": 1,
      "uniqueItems": true,
      "items": { "enum": ["human", "synthetic"] }
    },
    "requiredLeakageKeys": {
      "description": "Leakage keys every record of the given source kind must carry so split disjointness can be checked.",
      "type": "object",
      "additionalProperties": false,
      "required": ["real", "synthetic"],
      "properties": {
        "real": { "$ref": "#/$defs/leakageKeyList" },
        "synthetic": { "$ref": "#/$defs/leakageKeyList" }
      }
    }
  },
  "$defs": {
    "split": { "enum": ["train", "validation", "test"] },
    "sourceTier": {
      "enum": ["shippable", "research-only", "evaluation-external"]
    },
    "perSplitCount": {
      "type": "object",
      "additionalProperties": false,
      "properties": {
        "train": { "type": "integer", "minimum": 0 },
        "validation": { "type": "integer", "minimum": 0 },
        "test": { "type": "integer", "minimum": 0 }
      }
    },
    "leakageKeyList": {
      "type": "array",
      "uniqueItems": true,
      "items": { "enum": ["sessionId", "physicalCardIds", "sourceAssetIds"] }
    }
  }
}
