{
  "allowedSourceTiers": [
    "shippable"
  ],
  "description": "Successor to training-minimums-v3 with the same split totals. Adds requireTargetSemantics: every real archive record must carry verified primary-category (whole-card) target provenance under a declared targetSemantics contract, so slabs and card subregions can never re-enter a training corpus as cards. Real archive scene slices follow the category-aware importer: single_card_archive holds single-card frames only, while multi-card frames are sliced by measured layout (multi_card_grid_archive, multi_card_scatter_archive, multi_card_other_archive) and never share a name with synthetic or Dev Mode slices. Minimums for the archive slices were set from the 2026-09-06 repaired candidate counts (4,204 / 778 / 1,065 train instances) after removing 749 train and 235 validation non-card targets. Frozen real v6-full and synthetic multigame evaluations remain separate pinned releases whose records must never be copied into this corpus. Real polygon fits support training but are not metric ground truth.",
  "metricEligibleCornerSources": [
    "human",
    "synthetic"
  ],
  "minimumInstancesPerSplit": {
    "train": 20000,
    "validation": 3000
  },
  "minimumMetricEligibleInstances": {
    "train": 10000,
    "validation": 1000
  },
  "minimumRealEvaluationSessions": 0,
  "minimumRecordsPerSplit": {
    "train": 12000,
    "validation": 2000
  },
  "policyId": "training-minimums-v4",
  "realOnlySplits": [],
  "requireTargetSemantics": true,
  "requiredLeakageKeys": {
    "real": [
      "sourceAssetIds"
    ],
    "synthetic": [
      "physicalCardIds",
      "sourceAssetIds"
    ]
  },
  "requiredSceneSlices": [
    {
      "minimumInstances": 4000,
      "minimumMetricEligibleInstances": 0,
      "sceneSlice": "single_card_archive",
      "split": "train"
    },
    {
      "minimumInstances": 700,
      "minimumMetricEligibleInstances": 0,
      "sceneSlice": "multi_card_grid_archive",
      "split": "train"
    },
    {
      "minimumInstances": 1000,
      "minimumMetricEligibleInstances": 0,
      "sceneSlice": "multi_card_scatter_archive",
      "split": "train"
    },
    {
      "minimumInstances": 1000,
      "minimumMetricEligibleInstances": 0,
      "sceneSlice": "single_card_archive",
      "split": "validation"
    },
    {
      "minimumInstances": 150,
      "minimumMetricEligibleInstances": 150,
      "sceneSlice": "single_handheld",
      "split": "validation"
    },
    {
      "minimumInstances": 75,
      "minimumMetricEligibleInstances": 75,
      "sceneSlice": "single_handheld_distractor_free",
      "split": "validation"
    },
    {
      "minimumInstances": 150,
      "minimumMetricEligibleInstances": 150,
      "sceneSlice": "steep_playmat",
      "split": "validation"
    },
    {
      "minimumInstances": 900,
      "minimumMetricEligibleInstances": 900,
      "sceneSlice": "duel_field",
      "split": "validation"
    },
    {
      "minimumInstances": 1000,
      "minimumMetricEligibleInstances": 1000,
      "sceneSlice": "binder_page",
      "split": "validation"
    }
  ],
  "requiredSplits": [
    "train",
    "validation"
  ],
  "schema": "https://tcger.app/schemas/card-geometry-readiness-policy/v1"
}
