{
  "allowedSourceTiers": [
    "shippable"
  ],
  "description": "Approved minimum coverage for the first shared card-geometry training bake-off. Frozen before candidates are trained; synthetic data is forbidden from test and only shippable-tier sources may enter the release.",
  "metricEligibleCornerSources": [
    "human",
    "synthetic"
  ],
  "minimumInstancesPerSplit": {
    "test": 150,
    "train": 1000,
    "validation": 100
  },
  "minimumMetricEligibleInstances": {
    "test": 100,
    "train": 1000,
    "validation": 100
  },
  "minimumRealEvaluationSessions": 3,
  "minimumRecordsPerSplit": {
    "test": 100,
    "train": 500,
    "validation": 50
  },
  "policyId": "training-minimums-v1",
  "realOnlySplits": [
    "test"
  ],
  "requiredLeakageKeys": {
    "real": [],
    "synthetic": [
      "physicalCardIds",
      "sourceAssetIds"
    ]
  },
  "requiredSceneSlices": [
    {
      "minimumInstances": 50,
      "sceneSlice": "single_handheld",
      "split": "test"
    },
    {
      "minimumInstances": 20,
      "sceneSlice": "steep_playmat",
      "split": "test"
    },
    {
      "minimumInstances": 30,
      "sceneSlice": "duel_field",
      "split": "test"
    },
    {
      "minimumInstances": 20,
      "sceneSlice": "binder_page",
      "split": "test"
    }
  ],
  "requiredSplits": [
    "train",
    "validation",
    "test"
  ],
  "schema": "https://tcger.app/schemas/card-geometry-readiness-policy/v1"
}
